{
  "$schema": "https://podeley.ar/data/equipos-parque.schema.json",
  "titulo": "Registro del parque de equipos: perforación, fractura y workover en Argentina",
  "actualizado": "2026-09-01",
  "licencia": "CC BY 4.0",
  "nota_metodo": "El registro tiene dos capas y no las mezcla. La capa de empresas dice quiénes operan equipos en cada segmento y cuántos: cuando las fuentes publican cifras distintas, la fila lleva un rango con todas las fuentes, nunca un promedio. La capa de equipos son fichas individuales que sólo existen donde hubo anuncio público: cada especificación lleva su propia fuente, porque las fichas se arman juntando notas sueltas y ninguna fuente las repite completas. Los totales por segmento anclan en el relevamiento mensual de Fucello (fracstages.com) y en el de TecnoPatagonia, que son la referencia de facto de la industria; no existe padrón oficial y esa ausencia está documentada, con fecha, en el objeto oficial. El registro publica sólo el estado vigente: la serie histórica es el historial git de este archivo más el arreglo correcciones. Lo que estima o deriva el registro lleva prefijo est_.",
  "nota_correcciones": "Este registro se publicó sin consultar antes a las empresas nombradas. Las correcciones que lleguen se aplican a la fila y se anotan en el arreglo correcciones, con fecha, qué cambió y quién lo señaló. Nada se edita en silencio.",
  "correcciones": [],

  "oficial": {
    "consultado": "2026-09-01",
    "padron": null,
    "nota": "No existe padrón oficial a nivel equipo. El catálogo de datos abiertos de la Secretaría de Energía tenía 178 datasets el día de la consulta y ninguno registra equipos individuales de perforación, fractura o intervención: las búsquedas por equipo, rig, workover, pulling y torre devuelven cero, y el dataset de perforación agrega pozos y metros por empresa y cuenca, nunca equipos. El portal de datos abiertos de Neuquén tampoco. Lo único oficial que roza el nivel equipo es el campo potencia_equipos_fractura_hp del Adjunto IV.",
    "adjunto_iv": {
      "url": "http://datos.energia.gob.ar/dataset/datos-de-fractura-de-pozos-adjunto-iv",
      "dataset": "71fa2e84-0316-4a1b-af68-7f35e41f58d7",
      "recurso": "2280ad92-6ed3-403e-a095-50139863ab0d",
      "consultado": "2026-09-01",
      "advertencia": "El campo empresa_informante es la operadora del pozo, no la empresa de servicio que fractura: el dato oficial no puede atribuir un set a su dueño. Y la potencia informada es la del set asignado al pozo según la convención de cada operadora, no un censo de equipos: hay operadoras que informan la potencia nominal redondeada, una que informa la desplegada por pozo y una cuyo valor es implausible."
    }
  },

  "campos": {
    "perfil": "servicio es el contratista que opera equipos para terceros; operadora es la petrolera que perfora o interviene con equipos propios, como PAE o YPF.",
    "conteos": "Cantidad de equipos de la empresa en un segmento. Exactamente una de dos formas: cantidad, cuando las fuentes coinciden, o cantidad_min y cantidad_max, cuando publican cifras distintas. El rango no es imprecisión del registro: es el desacuerdo real entre fuentes, y las fuentes de ambos extremos van en la fila.",
    "confianza": "Califica la procedencia de las cifras, no el desempeño de la empresa. alta = documento auditado o dato primario de la empresa; media = relevamiento sectorial o comunicado; baja = sólo prensa.",
    "tecnologia": "Tecnologías presentes en la flota de la empresa en Argentina, sin cuantificar. La cuantificación, cuando existe, va en los conteos o en la ficha del equipo.",
    "id_publico": "Identificador con el que la industria nombra al equipo, como DLS-177 o SAI-652. Los sets de fractura no tienen identificador público: llevan null y un id descriptivo propio del registro, y esa asimetría es un dato, no una omisión.",
    "specs": "Especificaciones técnicas del equipo, cada una con su propia fuente. El vocabulario de specs es cerrado y crece por agregado; una ficha sin identificador público y sin ninguna spec con fuente no entra al registro.",
    "estado": "activo, anunciado, en-armado, inactivo o sin-dato, con la fecha del dato en estado_fecha. anunciado significa contrato o llegada comunicados pero equipo todavía no operando.",
    "est_hhp_operadoras": "Derivado propio del Adjunto IV: la potencia de equipos de fractura que cada operadora informa en sus pozos, agregada por el registro en una ventana de tiempo. confiable en false marca las operadoras cuya convención de reporte hace inutilizable el valor; esas filas se publican igual y no entran en ningún agregado."
  },

  "segmentos": [
    {
      "segmento": "perforacion",
      "total": 54,
      "unidad": "equipos",
      "fecha_dato": "2026-07",
      "shale": 41,
      "convencional": 13,
      "nota": "Julio de 2026 fue la primera vez que la cuenca Neuquina superó los 40 equipos de perforación activos.",
      "fuentes": [
        "https://dataenergia.ar/petroleo-y-combustibles/en-julio-la-flota-de-torres-de-perforacion-supero-los-40-equipos-shale-y-alcanzo-los-54-rigs-activos-202681414420",
        "https://mase.lmneuquen.com/vaca-muerta/julio-fue-el-mes-los-rigs-vaca-muerta-supero-primera-vez-los-40-perforadores-activos-n1249740"
      ]
    },
    {
      "segmento": "fractura",
      "total": 15,
      "unidad": "sets",
      "fecha_dato": "2026-07",
      "dual_fuel": 5,
      "dual_fuel_fecha": "2026-02",
      "dual_fuel_fuentes": ["https://mase.lmneuquen.com/gas/dual-fuel-la-nueva-estrategia-la-eficiencia-vaca-muerta-n1229814"],
      "electricos_anunciados": 4,
      "electricos_nota": "Cuatro sets eléctricos Zeus del contrato YPF–Halliburton, con el primero anunciado para octubre de 2026.",
      "nota": "El total ancla en el relevamiento de Fucello. Los desgloses por empresa publicados en prensa no cierran contra este total; por eso las filas de empresas llevan rangos.",
      "fuentes": [
        "https://www.fracstages.com/",
        "https://mase.lmneuquen.com/vaca-muerta/los-sets-fractura-vaca-muerta-tienen-un-30-capacidad-ociosa-n1249194"
      ]
    },
    {
      "segmento": "workover",
      "total": 47,
      "unidad": "equipos",
      "fecha_dato": "2026-07",
      "nota": "Un 17% menos que un año atrás. Ninguna fuente pública abre el total por empresa: las filas de empresas de este registro cubren solo los equipos que la prensa regional atribuye con nombre, 13 de los 47.",
      "fuentes": ["https://mase.lmneuquen.com/vaca-muerta/julio-fue-el-mes-los-rigs-vaca-muerta-supero-primera-vez-los-40-perforadores-activos-n1249740"]
    },
    {
      "segmento": "pulling",
      "total": 72,
      "unidad": "equipos",
      "fecha_dato": "2026-07",
      "nota": "Más de 1,400 intervenciones en el mes. Igual que en workover, el desglose por empresa no se publica: las filas de empresas cubren 18 de los 72.",
      "fuentes": ["https://mase.lmneuquen.com/vaca-muerta/julio-fue-el-mes-los-rigs-vaca-muerta-supero-primera-vez-los-40-perforadores-activos-n1249740"]
    }
  ],

  "empresas": [
    {
      "id": "halliburton",
      "nombre": "Halliburton",
      "perfil": "servicio",
      "conteos": [
        { "segmento": "fractura", "cantidad_min": 4, "cantidad_max": 8, "unidad": "sets", "fecha_dato": "2026-01", "confianza": "baja",
          "nota": "Cuatro sets durante 2025 según el repaso anual de Mase; ocho según Letra P, en una nota cuyo desglose suma 16 contra un total declarado de 13. El rango registra ambas versiones.",
          "fuentes": ["https://mase.lmneuquen.com/vaca-muerta/el-nuevo-reto-halliburton-vaca-muerta-n1224514", "https://www.letrap.com.ar/economia/quienes-mueven-los-fierros-vaca-muerta-los-nombres-detras-los-equipos-perforacion-y-fractura-n5421081"] }
      ],
      "tecnologia": ["diesel", "dual-fuel"],
      "nota": "Tres de sus sets son dual fuel, los más de la cuenca. En abril de 2026 ganó el contrato exclusivo de terminaciones de YPF a cinco años, que trae cuatro sets eléctricos Zeus desde octubre de 2026; en julio ejecutó el 55% de las etapas.",
      "fuentes": ["https://mase.lmneuquen.com/gas/dual-fuel-la-nueva-estrategia-la-eficiencia-vaca-muerta-n1229814", "https://www.shale24.com/oil-gas/vaca-muerta-primer-campo-fuera-eeuu-operar-zeus-ypf-adjudica-halliburton-contrato-exclusivo-terminaciones-convencionales-n973", "https://mase.lmneuquen.com/siete-sets-fractura-vaca-muerta-quedaron-parados-n1250111"]
    },
    {
      "id": "slb",
      "nombre": "SLB",
      "perfil": "servicio",
      "conteos": [
        { "segmento": "fractura", "cantidad_min": 2, "cantidad_max": 4, "unidad": "sets", "fecha_dato": "2026-01", "confianza": "baja",
          "nota": "Dos sets en el conteo de la cuenca de marzo de 2024; cuatro según Letra P en enero de 2026. Ninguna fuente posterior publica la cifra.",
          "fuentes": ["https://vacamuertanews.com/actualidad/de-la-mano-de-tenaris-vaca-muerta-sumo-un-nuevo-set-de-fractura-y-ya-son-10-los-equipos.htm", "https://www.letrap.com.ar/economia/quienes-mueven-los-fierros-vaca-muerta-los-nombres-detras-los-equipos-perforacion-y-fractura-n5421081"] }
      ],
      "tecnologia": ["diesel"],
      "nota": "Desde el contrato exclusivo YPF-Halliburton opera sin dedicación exclusiva, a demanda; ejecutó el 26% de las etapas de julio de 2026. En 2024 importó un set para los bloques de Vista.",
      "fuentes": ["https://www.shale24.com/oil-gas/fracturas-vaca-muerta-halliburton-quedo-casi-toda-actividad-ypf-reconquisto-liderazgo-slb-consiguio-ultimo-ano-n1424", "https://www.rionegro.com.ar/energia/mas-fierros-para-vaca-muerta-vista-sello-un-acuerdo-con-slb-por-un-nuevo-set-de-fractura-3631715/"]
    },
    {
      "id": "tenaris",
      "nombre": "Tenaris",
      "perfil": "servicio",
      "conteos": [
        { "segmento": "fractura", "cantidad": 3, "unidad": "sets", "fecha_dato": "2026-08", "confianza": "media",
          "nota": null,